{
  "$schema": "http://json-schema.org/draft-07/schema#",
  "$id": "https://semantius.com/schemas/locale-file.json",
  "title": "Semantius language file",
  "description": "One language, in the single shape every place a language lives speaks: the files in i18n/ at the repository root, which the build emits as /locales/<code>.json, an operator's replacement of one, a stage host's copy, a work file's source. The map is FLAT. A code string is keyed by its own English source text (there are no message ids; a disambiguated one is prefixed, `columnVisibility.View`); model text is keyed by its model path under the reserved `module.` root (`module.nwind.orders.field.city.title`, an enum value by its STORED value); a server error by its SQLSTATE plus constraint name, or by its own template. en-US.json is the index: the same shape with the SOURCE text as the value of every key.",
  "type": "object",
  "required": ["locale"],
  "additionalProperties": false,
  "properties": {
    "locale": {
      "type": "string",
      "minLength": 2,
      "description": "The catalog language as a BCP-47 tag, e.g. de-DE. This is the language of the TEXT, never the formatting locale — those are two separate preferences."
    },
    "name": {
      "type": "string",
      "minLength": 1,
      "description": "The language's own name for itself ('Deutsch'). Wins over Intl.DisplayNames in the account menu, which is how a tag the browser has no display name for still reads as a language."
    },
    "messages": {
      "$ref": "#/$defs/translationMap",
      "description": "Key to translation. An empty value means 'not translated yet' and falls through to the source text — which is what discovery writes when the running app meets a key this language does not know."
    },
    "obsolete": {
      "$ref": "#/$defs/translationMap",
      "description": "Translations whose source was reworded or removed, kept so they are not lost silently. A code string lands here when the optional `i18n:extract` scan no longer finds the old wording; a `module.*` key lands here when the model English is reworded. Emptied by `i18n:extract --prune`."
    }
  },
  "$defs": {
    "translationMap": {
      "type": "object",
      "additionalProperties": { "type": "string" }
    }
  }
}
