{
  "locale": "de-DE",
  "name": "Deutsch",
  "messages": {
    "(required)": "(erforderlich)",
    "404 - Page Not Found": "404 – Seite nicht gefunden",
    "<strong>Note:</strong> Do not commit your <code>.env</code> file to version control. It should contain sensitive credentials and is already listed in <code>.gitignore</code>.": "<strong>Hinweis:</strong> Übertragen Sie Ihre <code>.env</code>-Datei nicht in die Versionsverwaltung. Sie enthält vertrauliche Zugangsdaten und ist bereits in <code>.gitignore</code> aufgeführt.",
    "API Key Created": "API-Schlüssel erstellt",
    "API Keys": "API-Schlüssel",
    "API key copied": "API-Schlüssel kopiert",
    "API keys": "API-Schlüssel",
    "Account": "Konto",
    "Actions": "Aktionen",
    "Active": "Aktiv",
    "Add Customer": "Kunde hinzufügen",
    "Add a new customer to the system.": "Einen neuen Kunden zum System hinzufügen.",
    "Add a new filter": "Neuen Filter hinzufügen",
    "Add filter": "Filter hinzufügen",
    "Add filters to refine your rows.": "Fügen Sie Filter hinzu, um Ihre Zeilen einzugrenzen.",
    "Add new API key": "Neuen API-Schlüssel hinzufügen",
    "Add sort": "Sortierung hinzufügen",
    "Add sorting to organize your rows.": "Fügen Sie eine Sortierung hinzu, um Ihre Zeilen zu ordnen.",
    "Add to favorites": "Zu Favoriten hinzufügen",
    "Add your first customer": "Ersten Kunden hinzufügen",
    "Add {label}": "{label} hinzufügen",
    "Add {label} to favorites": "{label} zu Favoriten hinzufügen",
    "All": "Alle",
    "Alt": "Alt",
    "An unexpected error occurred while loading the application.": "Beim Laden der Anwendung ist ein unerwarteter Fehler aufgetreten.",
    "An unexpected error occurred. Please try again or contact support if the problem persists.": "Ein unerwarteter Fehler ist aufgetreten. Bitte versuchen Sie es erneut oder wenden Sie sich an den Support, falls das Problem weiterhin besteht.",
    "An unexpected error occurred. Please try again.": "Ein unerwarteter Fehler ist aufgetreten. Bitte versuchen Sie es erneut.",
    "An unknown error occurred": "Ein unbekannter Fehler ist aufgetreten",
    "Application Failed to Start": "Anwendung konnte nicht gestartet werden",
    "Application Settings": "Anwendungseinstellungen",
    "Apps": "Apps",
    "Are you sure you want to delete <bold>{name}</bold>? This action cannot be undone.": "Möchten Sie <bold>{name}</bold> wirklich löschen? Diese Aktion kann nicht rückgängig gemacht werden.",
    "Are you sure you want to delete this {type}? This action cannot be undone.": "{type} wirklich löschen? Diese Aktion kann nicht rückgängig gemacht werden.",
    "Are you sure you want to revoke <bold>{name}</bold>? This action cannot be undone and any integrations using this key will stop working.": "Möchten Sie <bold>{name}</bold> wirklich widerrufen? Diese Aktion kann nicht rückgängig gemacht werden, und alle Integrationen, die diesen Schlüssel verwenden, funktionieren danach nicht mehr.",
    "Ascending": "Aufsteigend",
    "Authentication token is required": "Ein Authentifizierungstoken ist erforderlich",
    "Back to Home": "Zurück zur Startseite",
    "Browse and manage all customer records": "Alle Kundendatensätze durchsuchen und verwalten",
    "Browser default ({language})": "Browserstandard ({language})",
    "Browser default ({locale})": "Browserstandard ({locale})",
    "CLI configuration copied": "CLI-Konfiguration kopiert",
    "CRM Home": "CRM-Startseite",
    "CRM home": "CRM-Startseite",
    "CRM home · Detail": "CRM-Startseite · Detail",
    "Cancel": "Abbrechen",
    "Choose a color": "Farbe wählen",
    "Choose an icon": "Symbol wählen",
    "Choose date from calendar": "Datum im Kalender auswählen",
    "Choose the month": "Monat auswählen",
    "Choose the year": "Jahr auswählen",
    "Choose {field} from calendar": "{field} im Kalender auswählen",
    "Clear": "Leeren",
    "Clear all filters": "Alle Filter zurücksetzen",
    "Clear icon": "Symbol entfernen",
    "Clear search": "Suche löschen",
    "Clear selection": "Auswahl aufheben",
    "Clear sort": "Sortierung aufheben",
    "Close": "Schließen",
    "Close toast": "Benachrichtigung schließen",
    "Color": "Farbe",
    "Color format": "Farbformat",
    "Column actions": "Spaltenaktionen",
    "Column sort": "Spaltensortierung",
    "Command Palette": "Befehlspalette",
    "Company Name": "Firmenname",
    "Completing sign-in": "Anmeldung wird abgeschlossen",
    "Configuration Error": "Konfigurationsfehler",
    "Contains": "Enthält",
    "Continue Editing": "Weiter bearbeiten",
    "Copy API key": "API-Schlüssel kopieren",
    "Copy CLI configuration": "CLI-Konfiguration kopieren",
    "Copy the contents from <code>.env.example</code>": "Kopieren Sie den Inhalt aus <code>.env.example</code>",
    "Copy your API key now. You won't be able to see it again.": "Kopieren Sie Ihren API-Schlüssel jetzt. Sie können ihn später nicht mehr einsehen.",
    "Create": "Erstellen",
    "Create API Key": "API-Schlüssel erstellen",
    "Create Customer": "Kunde erstellen",
    "Create New Customer": "Neuen Kunden erstellen",
    "Create a <code>.env</code> file in your project root (or run <code>npm run genconfig</code>)": "Erstellen Sie eine <code>.env</code>-Datei im Stammverzeichnis Ihres Projekts (oder führen Sie <code>npm run genconfig</code> aus)",
    "Created": "Erstellt",
    "Ctrl": "Strg",
    "Current authentication token (for debugging purposes)": "Aktuelles Authentifizierungstoken (zu Debugging-Zwecken)",
    "Customer": "Kunde",
    "Customer Details": "Kundendetails",
    "Customer List": "Kundenliste",
    "Customer {id}": "Kunde {id}",
    "Customers": "Kunden",
    "Dark": "Dunkel",
    "Data": "Daten",
    "Debug Information": "Debug-Informationen",
    "Default ({language})": "Standard ({language})",
    "Delete": "Löschen",
    "Delete {type}": "{type} löschen",
    "Deleting...": "Wird gelöscht ...",
    "Descending": "Absteigend",
    "Detail View": "Detailansicht",
    "Details": "Details",
    "Discard Changes": "Änderungen verwerfen",
    "Documents": "Dokumente",
    "Does not contain": "Enthält nicht",
    "Done": "Fertig",
    "Drag to reorder": "Zum Umsortieren ziehen",
    "Drag to reorder filters": "Filter zum Umsortieren ziehen",
    "Edit": "Bearbeiten",
    "Edit Customer": "Kunde bearbeiten",
    "Edit customer {id}": "Kunde {id} bearbeiten",
    "Edit in Modal": "Im Dialog bearbeiten",
    "Edit in Sidebar": "In der Seitenleiste bearbeiten",
    "Email Address": "E-Mail-Adresse",
    "English is the source language. An entry saved here overrides the wording for this tenant.": "Englisch ist die Ausgangssprache. Ein hier gespeicherter Eintrag überschreibt die Formulierung für diesen Mandanten.",
    "English is the source language. Switch to the language you are translating.": "Englisch ist die Ausgangssprache. Wechseln Sie zu der Sprache, die Sie übersetzen.",
    "Enter a name to identify this API key.": "Geben Sie einen Namen ein, an dem Sie diesen API-Schlüssel erkennen.",
    "Enter a value...": "Wert eingeben ...",
    "Entity Information:": "Entitätsinformationen:",
    "Error Details:": "Fehlerdetails:",
    "Error creating record": "Fehler beim Anlegen des Datensatzes",
    "Error loading apps": "Fehler beim Laden der Apps",
    "Error loading customers": "Fehler beim Laden der Kunden",
    "Error loading data": "Fehler beim Laden der Daten",
    "Error loading record": "Fehler beim Laden des Datensatzes",
    "Error updating record": "Fehler beim Aktualisieren des Datensatzes",
    "Example configuration:": "Beispielkonfiguration:",
    "Extended documentation guide for {label}": "",
    "Failed to call RPC function \"{name}\" ({status})": "Die RPC-Funktion „{name}“ konnte nicht aufgerufen werden ({status})",
    "Failed to create {table} record ({status})": "Der {table}-Datensatz konnte nicht angelegt werden ({status})",
    "Failed to delete {table} record ({status})": "Der {table}-Datensatz konnte nicht gelöscht werden ({status})",
    "Failed to fetch RPC user info ({status})": "Die RPC-Benutzerinformationen konnten nicht geladen werden ({status})",
    "Failed to fetch options": "Die Optionen konnten nicht abgerufen werden",
    "Failed to fetch user info ({status})": "Die Benutzerinformationen konnten nicht geladen werden ({status})",
    "Failed to fetch user information from API": "Die Benutzerinformationen konnten nicht von der API abgerufen werden",
    "Failed to fetch user information from OAuth provider": "Die Benutzerinformationen konnten nicht vom OAuth-Anbieter abgerufen werden",
    "Failed to fetch {table} ({status})": "{table} konnte nicht geladen werden ({status})",
    "Failed to save dashboard: {message}": "Das Dashboard konnte nicht gespeichert werden: {message}",
    "Failed to update {table} record ({status})": "Der {table}-Datensatz konnte nicht aktualisiert werden ({status})",
    "False": "Nein",
    "False first": "Nein zuerst",
    "Favorites": "Favoriten",
    "Fields:": "Felder:",
    "Filter": "Filter",
    "Filters": "Filter",
    "Form Preview": "Formularvorschau",
    "Form playground": "Formular-Spielwiese",
    "Go to first page": "Zur ersten Seite",
    "Go to last page (approx)": "Zur letzten Seite (ungefähr)",
    "Go to next page": "Zur nächsten Seite",
    "Go to next page, page {page}": "Zur nächsten Seite, Seite {page}",
    "Go to previous page": "Zur vorherigen Seite",
    "Go to previous page, page {page}": "Zur vorherigen Seite, Seite {page}",
    "Go to the next month": "Zum nächsten Monat",
    "Go to the previous month": "Zum vorherigen Monat",
    "Grabbed sortable item \"{item}\". Current position is {position} of {total}. Use arrow keys to move, space to drop.": "Sortierbares Element „{item}“ aufgenommen. Aktuelle Position ist {position} von {total}. Verwenden Sie die Pfeiltasten zum Verschieben und die Leertaste zum Ablegen.",
    "Has any of": "Enthält eines von",
    "Has none of": "Enthält keines von",